臥聽銅龍，,起聽銅龍，,夜半哀江響半空。,聲也相同，,氣也相同，,相思無盡五更窮。,心在巫峰，,魂在巫峰，,恩愛此遭逢。,閒倚東風，,倦倚東風，,一園紅杏壁青蔥。,繁花惜已空，,今朝又見數枝紅。,鶯兒莫帶東風去，,只恐桃夭無力笑東風。,風清月白，,把寄香入客吟中。 Xuân đình lan điệuNguyệt tà nhân tĩnh thú lâu trung.,"Ngoạ thính đồng long,","Khởi thính đồng long,","Dạ bán ""Ai giang"" hưởng bán không.","Thanh dã tương đồng,","Khí dã tương đồng,",Tương tư vô tận ngũ canh cùng.,"Tâm tại Vu Phong,","Hồn tại Vu Phong,",Ân ái thử tao phùng.,"Nhàn ỷ đông phong,","Quyện ỷ đông phong,",Nhất viên hồng hạnh bích thanh thông.,"Phồn hoa tích dĩ không,",Kim triêu hựu kiến sổ chi hồng.,"Oanh nhi mạc đới xuân phong khứ,",Chỉ khủng đào yêu vô lực tiếu đông phong.,"Phong thanh nguyệt bạch,","Bả kì hương nhập khách ngâm trung.

春庭蘭調


","Xuân đình lan điệu
							","Bài ca theo điệu Xuân đình lan
月斜人靜戍樓中。",Nguyệt tà nhân tĩnh thú lâu trung.臥聽銅龍，,"Ngoạ thính đồng long,起聽銅龍，","Khởi thính đồng long,夜半哀江響半空。","Dạ bán ""Ai giang"" hưởng bán không.聲也相同，","Thanh dã tương đồng,氣也相同，","Khí dã tương đồng,相思無盡五更窮。",Tương tư vô tận ngũ canh cùng.心在巫峰，,"Tâm tại Vu Phong,魂在巫峰，","Hồn tại Vu Phong,恩愛此遭逢。",Ân ái thử tao phùng.閒倚東風，,"Nhàn ỷ đông phong,倦倚東風，","Quyện ỷ đông phong,一園紅杏壁青蔥。",Nhất viên hồng hạnh bích thanh thông.繁花惜已空，,"Phồn hoa tích dĩ không,今朝又見數枝紅。",Kim triêu hựu kiến sổ chi hồng.鶯兒莫帶東風去，,"Oanh nhi mạc đới xuân phong khứ,只恐桃夭無力笑東風。",Chỉ khủng đào yêu vô lực tiếu đông phong.風清月白，,"Phong thanh nguyệt bạch,把寄香入客吟中。",到此須教眼放青。,白水磨成千刃劍，,寒潭飛落一天星。,怪形未已標三甲，,神力奚庸鑿五丁。,仿佛雲頹頭暗點，,高僧應有坐談經。 Nhãn phóng thanhVi mang loa đại tháp thương minh,Đáo thử tu giao nhãn phóng thanh,Bạch thuỷ ma thành thiên nhẫn kiếm,Hàn đàm phi lạc nhất thiên tinh,Quái hình vị dĩ tiêu tam giáp,Thần lực hề dung tạc Ngũ Đinh,Phảng phất vân đồi đầu ám điểm,"Cao tăng ưng hữu toạ đàm kinh. 
Dịch nghĩa
Mầu lam nhạt mờ mờ nối trời xa với bể xa.","Đến đây, tưởng như trong aắt toả sắc xanh ra",Nước bạc mài đá thành nghìn mũi gươm nhọn,"Giữa đầm vắng, hình như có một sao trời sa xuống.","Vách đá hình kì quái không dễ dùng làm bảng đề danh kẻ đỗ đại khoa,",Nếu không sức thần thì sao tạc nổi tượng lực sĩ hùng dũng như vậy.,"Phảng phất mây xuống thấp, phía trên đã xẩm tối,","Chắc đã có vị cao tăng ngồi yên lặng tụng kinh.

眼放青


","Nhãn phóng thanh
							","Mắt toả màu xanh
微茫螺黛拓滄溟，",Vi mang loa đại tháp thương minh,Mầu lam nhạt mờ mờ nối trời xa với bể xa.到此須教眼放青。,Đáo thử tu giao nhãn phóng thanh,"Đến đây, tưởng như trong aắt toả sắc xanh ra白水磨成千刃劍，",Bạch thuỷ ma thành thiên nhẫn kiếm,Nước bạc mài đá thành nghìn mũi gươm nhọn寒潭飛落一天星。,Hàn đàm phi lạc nhất thiên tinh,"Giữa đầm vắng, hình như có một sao trời sa xuống.怪形未已標三甲，",Quái hình vị dĩ tiêu tam giáp,"Vách đá hình kì quái không dễ dùng làm bảng đề danh kẻ đỗ đại khoa,神力奚庸鑿五丁。",Thần lực hề dung tạc Ngũ Đinh,Nếu không sức thần thì sao tạc nổi tượng lực sĩ hùng dũng như vậy.仿佛雲頹頭暗點，,Phảng phất vân đồi đầu ám điểm,"Phảng phất mây xuống thấp, phía trên đã xẩm tối,高僧應有坐談經。",Cao tăng ưng hữu toạ đàm kinh.,"Ba quân khiêng kiệu, kiệu nghêng ngang.","Xin theo ông Khổng về Ðông Lỗ,",長亭酒餞尚酬醪。,悶堆帆翅船偏重，,愁壓江心水不潮。,舊草凝眸香未散，,他鄉回首夢孤高。,雖然尚有相逢日，,"誓海寧容一浪濤。 Giang Nam phụ níp kiêm lưu biệt hữu nhânPhụ níp tòng kim vạn lý dao,",Trường đình tửu tiễn thượng thù giao.,"Muộn đôi phàm sí thuyền thiên trọng,",Sầu áp giang tâm thuỷ bất trào.,"Cựu thảo ngưng mâu hương vị tán,",Tha hương hồi thủ vọng cô cao.,"Tuy nhiên thượng hữu tương phùng nhật,","Thệ hải ninh dung nhất lãng đào.

江南負笈兼留別故人


","Giang Nam phụ níp kiêm lưu biệt hữu nhân
							","Khăn gói sang sông Nam, nhân gửi bạn
負笈從今萬里遙，","Phụ níp tòng kim vạn lý dao,長亭酒餞尚酬醪。",Trường đình tửu tiễn thượng thù giao.悶堆帆翅船偏重，,"Muộn đôi phàm sí thuyền thiên trọng,愁壓江心水不潮。",Sầu áp giang tâm thuỷ bất trào.舊草凝眸香未散，,"Cựu thảo ngưng mâu hương vị tán,他鄉回首夢孤高。",Tha hương hồi thủ vọng cô cao.雖然尚有相逢日，,"Tuy nhiên thượng hữu tương phùng nhật,誓海寧容一浪濤。",Nước non sầu nặng luống đi về.,"Cung Hoàng dịu vợi dường khôn lọt,",Đường Nguyệt mơ màng giấc hãy mê.,"Đã chắc hương đâu cho lửa bén,",Lệ mà hoa lại quyến xuân đi.,"Xanh vàng chẳng phụ lòng ân ái,",Cái nợ phù sinh có thế thôi,Chôn chặt văn chương ba thước đất,Ném tung hồ thỉ bốn phương trời,Nắm xương dưới đất chau mày khóc,Hòn máu trên tay mỉm miệng cười,Đã thế thời thôi cho mát mẻ,Tuần trăng sẽ nhớ bữa đêm thu.,"Bên am Nhất Trụ trông còn đấy,",Ngọn nước Tam Kỳ chảy lại đâu.,"Son phấn trộm mừng duyên để lại,",Bèo mây thêm tủi phận về sau.,"Trăm năm biết có duyên thừa nữa,",Phong tình chước ấy đã hay chưa.,"Đem lời vàng ngọc gieo nên tiếng,","Sẻ nợ tang bồng giả với thơ,","Gặp gỡ cũng là trong bốn bể,",Phao tung kẻo thẹn trước nghìn xưa.,Sau này dầu có bao nhiêu nữa.,景比山陽更覺幽。,生面獨開雲露骨，,斷鼇爭崎客回頭。,馮夷疊作擎天柱，,龍女添為海屋籌。,大抵始皇鞭未及，,古留南甸鞏金甌。 Hải ốc trùLan nhiêu tuỳ ý dạng trung lưu,Cảnh tỉ sơn dương cánh giác u,Sinh diện độc khai vân lộ cốt,Đoạn ngao tranh kị khách hồi đầu,Bằng Di diệp tác kình thiên trụ,Long Nữ thiêm vi hải ốc trù,Đại để Thuỷ Hoàng tiên vị cập,"Cố lưu Nam điện củng kim âu. 
Dịch nghĩa
Phe phẩy mái chèo, tuỳ thích cỡi thuyền dong chơi giữa duềnh,",Qua gần chân núi lại thấy cảnh càng vắng.,"Mây thoảng qua, núi lộ mặt, thấy đá chơ vơ,","Những khối lèn dựng cao vút khi qua dưới, khách phải vếch trông.","Hoặc là hải thần Bằng Di đã dựng cột để chống trời nghiêng,",Hoặc là hải thần Long Nữ đã nối thêm cây nêu trỏ cung điện dưới bể.,"Ý chừng vua Tần Thuỷ Hoàng chưa từng đi kinh lí đến chỗ này,","Vì trời vốn dành nó lại ở xứ Nam này để làm vững chắc cơ đồ nước ta.

海屋籌


","Hải ốc trù
							","Ngóng đỉnh toan ngoan
蘭橈隨意漾中流，",Lan nhiêu tuỳ ý dạng trung lưu,"Phe phẩy mái chèo, tuỳ thích cỡi thuyền dong chơi giữa duềnh,景比山陽更覺幽。",Cảnh tỉ sơn dương cánh giác u,Qua gần chân núi lại thấy cảnh càng vắng.生面獨開雲露骨，,Sinh diện độc khai vân lộ cốt,"Mây thoảng qua, núi lộ mặt, thấy đá chơ vơ,斷鼇爭崎客回頭。",Đoạn ngao tranh kị khách hồi đầu,"Những khối lèn dựng cao vút khi qua dưới, khách phải vếch trông.馮夷疊作擎天柱，",Bằng Di diệp tác kình thiên trụ,"Hoặc là hải thần Bằng Di đã dựng cột để chống trời nghiêng,龍女添為海屋籌。",Long Nữ thiêm vi hải ốc trù,Hoặc là hải thần Long Nữ đã nối thêm cây nêu trỏ cung điện dưới bể.大抵始皇鞭未及，,Đại để Thuỷ Hoàng tiên vị cập,"Ý chừng vua Tần Thuỷ Hoàng chưa từng đi kinh lí đến chỗ này,古留南甸鞏金甌。",Cố lưu Nam điện củng kim âu.,Trách người quân tử hẹn sai ra.,"Bao giờ thong thả lên chơi nguyệt,",錯認桃源是薜蘿。,寄語挳舟從釣子，,過江應不聽琵琶。,過江莫聽琵琶，,高聲不似胡笳悽涼。,桃源水闊山長，,漁翁一棹仙堂半開。,萬重春鎖天台，,琴聲樂角聲哀不同。,寒山草色蔥蔥，,"蘇溪幾到清風自閑。 Ngư ông khúc hànhDã ông đạm bạc diệc phồn hoa,",Thác nhận Đào Nguyên thị bệ la.,"Ký ngữ khinh chu tòng điếu tử,",Quá giang ưng bất thính tỳ bà.,"Quá giang mạc thính tỳ bà,",Cao thanh bất tự Hồ già thê lương.,"Đào nguyên thuỷ khoát sơn trường,",Ngư ông nhất trạo tiên đường bán khai.,"Vạn trùng xuân toả Thiên Thai,","Cầm thanh lạc, giốc thanh ai bất đồng.","Hàn sơn thảo sắc thông thông,","Tô khê kỷ đáo thanh phong tự nhàn.

漁翁曲行


","Ngư ông khúc hành
							","Khúc hát về ngư ông
野翁淡泊亦繁花，","Dã ông đạm bạc diệc phồn hoa,錯認桃源是薜蘿。",Thác nhận Đào Nguyên thị bệ la.寄語挳舟從釣子，,"Ký ngữ khinh chu tòng điếu tử,過江應不聽琵琶。",Quá giang ưng bất thính tỳ bà.過江莫聽琵琶，,"Quá giang mạc thính tỳ bà,高聲不似胡笳悽涼。",Cao thanh bất tự Hồ già thê lương.桃源水闊山長，,"Đào nguyên thuỷ khoát sơn trường,漁翁一棹仙堂半開。",Ngư ông nhất trạo tiên đường bán khai.萬重春鎖天台，,"Vạn trùng xuân toả Thiên Thai,琴聲樂角聲哀不同。","Cầm thanh lạc, giốc thanh ai bất đồng.寒山草色蔥蔥，","Hàn sơn thảo sắc thông thông,蘇溪幾到清風自閑。",Chị cũng xinh mà em cũng xinh,Trăm vẻ như in tờ giấy trắng,Ngàn năm còn mãi cái xuân xanh,Phiếu mai chăng dám đường kia nọ,Bồ liễu thôi đành phận mỏng manh,Có một thú vui sao chẳng vẽ,"Người thì lên đánh kẻ ngồi trông,",Trai co gối hạc khom khom cật,Gái uốn lưng ong ngửa ngửa lòng.,"Bốn mảnh quần hồng bay phấp phới,",Hai hàng chân ngọc duỗi song song.,Chơi xuân đã biết xuân chăng tá.,旅況淒涼入夢醒。,吟客有神來色相，,情魔無力卻愁兵。,衾中半瘦風流骨，,榻上平分海角情。,一片無聊言不盡，,"塵寰安得眼雙清。 Bán chẩm thư hoàiBán thiên phong vũ bán thiên tình,",Lữ huống thê lương nhập mộng tinh.,"Ngâm khách hữu thần lai sắc tướng,",Tình ma vô lực khước sầu binh.,"Khâm trung bán sấu phong lưu cốt,",Tháp thượng bình phân hải giác tình.,"Nhất phiến vô liêu ngôn bất tận,","Trần hoàn an đắc nhãn song thanh.

半枕書懷


","Bán chẩm thư hoài
							","Nỗi niềm gối lẻ
半天風雨半天晴，","Bán thiên phong vũ bán thiên tình,旅況淒涼入夢醒。",Lữ huống thê lương nhập mộng tinh.吟客有神來色相，,"Ngâm khách hữu thần lai sắc tướng,情魔無力卻愁兵。",Tình ma vô lực khước sầu binh.衾中半瘦風流骨，,"Khâm trung bán sấu phong lưu cốt,榻上平分海角情。",Tháp thượng bình phân hải giác tình.一片無聊言不盡，,"Nhất phiến vô liêu ngôn bất tận,塵寰安得眼雙清。",Trèo lên chớ ngại mỏi xương nhèo.,"Cành la cành bổng vin co vít,",Tiễn đưa ba bước cũng nên câu.,"Trên tay khép mở tanh chiều nhạn,",Trước mặt đi về gấp bóng câu.,Nước mắt trên hoa là lỗi cũ.,Mùi hương trong nệm cả đêm thâu.,"Vắng nhau mới biết tình nhau lắm,",Bảy nổi ba chìm mấy nước non,Rắn nát mặc dầu tay kẻ nặn,Kinh thành ngày trước tỉnh bây giờ,Tượng đồng Trấn Vũ hương còn ngát,Bia đá Khuê Văn chữ chửa mờ,Bảo tháp lơ thơ chòm cỏ mới,Hồ sông lai láng bóng trăng xưa,Nào ai cố lão ra đây hỏi,Cái kiếp phù sinh những nợ nần.,"Cửa viện xuân về hoa mát mẻ,",Đài trang mây náu nguyệt băn khoăn.,"Duyềnh xanh nước chảy tin lai láng,",Lá thăm thơ gieo bút ngại ngầm.,"Son phấn dám đâu so ngọn bút,",Mở mặt vuông tròn với thế gian.,"Kém cạnh cho nên mang tiếng hoẻn, ","Dao vọng sơn hình tự mã yên,","Cổ tự môn tòng lâm lộc xuất,","Giang Phi động tại thạch bình gian,","Phiếm châu hữu khách ca minh nguyệt,","Cao ngận hà nhân tuý thạch bàn,","Sơn đỉnh bất tri tang hải biến,",倏往來兮照予懷。,惋故人兮天涯，,愛不見兮心徘徊。,苔荒神女廟，,雲散楚王臺。,明月光如許，,"我思之人兮焉在哉。 Nguyệt dạ ca kỳ 1Lộ như châu hề nguyệt như sai,",Thúc vãng lai hề chiếu dư hoài.,"Uyển cố nhân hề thiên nhai,",Ái bất kiến hề tâm bồi hồi.,"Đài hoang Thần nữ miếu,",Vân tán Sở vương đài.,"Minh nguyệt quang như hử,","Ngã tứ chi nhân hề yên tại tai? 
Dịch nghĩa
Sương như hạt châu chừ, trăng như ngọc,","Vụt qua lại chừ, soi chiếu lòng ta.","Người xưa dịu dàng chừ phương trời,",Yêu như không gặp chừ lòng bồi hồi.,"Rêu hoang miếu Thần Nữ,",Mây tan đài Sở Vương.,"Ánh trăng sánh như vậy,","Người mà ta nhớ chừ, ở nơi đâu?

月夜歌其一


","Nguyệt dạ ca kỳ 1
							","Bài hát đêm trăng kỳ 1
露如珠兮月如瑳，","Lộ như châu hề nguyệt như sai,","Sương như hạt châu chừ, trăng như ngọc,倏往來兮照予懷。",Thúc vãng lai hề chiếu dư hoài.,"Vụt qua lại chừ, soi chiếu lòng ta.惋故人兮天涯，","Uyển cố nhân hề thiên nhai,","Người xưa dịu dàng chừ phương trời,愛不見兮心徘徊。",Ái bất kiến hề tâm bồi hồi.,Yêu như không gặp chừ lòng bồi hồi.苔荒神女廟，,"Đài hoang Thần nữ miếu,","Rêu hoang miếu Thần Nữ,雲散楚王臺。",Vân tán Sở vương đài.,Mây tan đài Sở Vương.明月光如許，,"Minh nguyệt quang như hử,","Ánh trăng sánh như vậy,我思之人兮焉在哉。",Ngã tứ chi nhân hề yên tại tai?,十載風塵慣耳鈴。,已是臨枰知敵手，,莫須敲月苦殫精。,為輪為彈隨遭遇，,誰鳳誰鶯任賦生。,造物於人何苟惜，,"明珠休向暗中呈。 Dữ Sơn Nam Thượng Hiệp trấn quan Trần Hầu xướng hoạ kỳ 7Quý vô tài điệu sử nhân kinh,",Thập tải phong trần quán nhĩ linh.,"Dĩ thị lâm bình tri địch thủ,",Mạc tu xao nguyệt khổ đàn tinh.,"Vi luân vi đạn tuỳ tao ngộ,",Thuỳ phụng thuỳ oanh nhiệm phú sinh.,"Tạo vật ư nhân hà cẩu tích,","Minh châu hưu hướng ám trung trình. 
Dịch nghĩa
Tôi thẹn vì không đủ tài điệu để người khiếp sợ.",Mười năm gió bụi đã quen rồi.,"Đã là ngồi trước bàn cờ thì biết địch thủ,",Làm chi phải chọn ý tứ cho khổ sở vì thơ.,"Là bánh xe hay đất đá là do hoàn cảnh,",Là phượng hay oanh vốn bẩm sinh.,"Tạo vật đối với con người không phú bẩm cẩu thả,","Nếu đã là hạt trai sáng thì chớ đem vào bóng tối.

與山南上協鎮官陳侯唱和其七


","Dữ Sơn Nam Thượng Hiệp trấn quan Trần Hầu xướng hoạ kỳ 7
							","Xướng hoạ cùng ông Trần Hầu, quan Hiệp trấn Sơn Nam Thượng kỳ 7
愧無才調使人驚，","Quý vô tài điệu sử nhân kinh,",Tôi thẹn vì không đủ tài điệu để người khiếp sợ.十載風塵慣耳鈴。,Thập tải phong trần quán nhĩ linh.,Mười năm gió bụi đã quen rồi.已是臨枰知敵手，,"Dĩ thị lâm bình tri địch thủ,","Đã là ngồi trước bàn cờ thì biết địch thủ,莫須敲月苦殫精。",Mạc tu xao nguyệt khổ đàn tinh.,Làm chi phải chọn ý tứ cho khổ sở vì thơ.為輪為彈隨遭遇，,"Vi luân vi đạn tuỳ tao ngộ,","Là bánh xe hay đất đá là do hoàn cảnh,誰鳳誰鶯任賦生。",Thuỳ phụng thuỳ oanh nhiệm phú sinh.,Là phượng hay oanh vốn bẩm sinh.造物於人何苟惜，,"Tạo vật ư nhân hà cẩu tích,","Tạo vật đối với con người không phú bẩm cẩu thả,明珠休向暗中呈。",Minh châu hưu hướng ám trung trình.,Mượn ai tới đấy gửi cho cùng.,"Chữ tình chốc đã ba năm vẹn,",Giấc mộng rồi ra nửa khắc không.,"Xe ngựa trộm mừng duyên tấp nập,",Phấn son càng tủi phận long đong.,"Biết còn mảy chút sương siu mấy,",Qua sông rồi lại đấm ngay bòi!,"Chèo ghe vừa khỏi dòng sông ngược,",Đấm cọc ngay vào ngấn nước xuôi.,"Mới biết lên bờ đà vỗ đít,",Nào khi giữa khúc đã co vòi.,Chuyến đò nên nghĩa sao không nhớ?,Man mác lòng riêng lại ngỡ càng.,"Lối bước đèo mây đành chẳng đã,",Mảnh nguyền hương lửa ngỡ lên đường.,"Nước non lời nọ nào chuông chắn,",Trăng gió lòng kia mãi chán chường.,Đày đoạ thân này thôi chẳng tiếc.,Nghĩ tưởng năm canh nguyệt hé lầu.,"Lá nhuộm thức lam thêm vẻ thẹn,",Sương pha khói biếc rộn thêm sầu.,"Thẩn thơ trước viện, nhà khoe gió,","Đồng vọng bên tai, địch thét đâu,","Ướm hỏi trăng già khe khắc bấy,",Chữ tình ai nỡ dứt cho xong,Những người trong cuộc nhiều người lạ,Là của trên đời vốn của chung,Duyên phận ngán thay thân yểu điệu,Tài hoa gầy cả mặt anh hùng,Này thơ ai tặng ai ai đó,雲樓酒冷銀環半。,水闊風長玉漏孤，,花月月花主人吾。,春寂寂，,春興不多乎。,鴈影何歸雲自住，,蛩聲如訴水空流，,"歲晏須圖。 Thu dạ hữu hoàiDạ thâm nhân tĩnh độc trù trừ,",Vân lâu tửu lãnh ngân hoàn bán.,"Thuỷ khoát phong trường ngọc lậu cô,",Hoa nguyệt hoa nguyệt chủ nhân ngô.,"Xuân tịch tịch,",Xuân hứng bất đa hồ.,"Nhạn ảnh hà quy vân tự trụ,","Cùng thanh như khốc thuỷ không lưu,","Tuế án tu đồ.

秋夜有懷


","Thu dạ hữu hoài
							","Đêm thu cảm hoài
夜深人靜獨躊躇，","Dạ thâm nhân tĩnh độc trù trừ,雲樓酒冷銀環半。",Vân lâu tửu lãnh ngân hoàn bán.水闊風長玉漏孤，,"Thuỷ khoát phong trường ngọc lậu cô,花月月花主人吾。",Hoa nguyệt hoa nguyệt chủ nhân ngô.春寂寂，,"Xuân tịch tịch,春興不多乎。",Xuân hứng bất đa hồ.鴈影何歸雲自住，,"Nhạn ảnh hà quy vân tự trụ,蛩聲如訴水空流，","Cùng thanh như khốc thuỷ không lưu,歲晏須圖。",Cớ sao khi khuyết lại khi tròn?,Hỏi con Bạch Thố đà bao tuổi?,Hỏi chị Hằng Nga đã mấy con?,Đêm tối cớ sao soi gác tía?,Ngày xanh còn thẹn mấy vầng tròn.,Năm canh lơ lửng chờ ai đó?,Nghĩ kẻ tìm thơm cũng có công.,"Lạ mặt dám quen cùng gió nước,",Nặng lòng nên nhẹ đến non sông.,"Da trời nắng nhuộm tươi màu biếc,",Phòng gấm trăng in dãi thức hồng.,"Ai nhớ lấy cho lòng ấy nhỉ,",Thò ra đứng chẹt giữa đường Thanh,Hai bên khép lại hơi gần tí,Một dải thông qua chút đỉnh đinh,Thế lộ có đâu ngăn đón mặt,Nhân tình ai chịu cản ngang mình,Bấy nhiêu năm trước nghe còn chẹt,Chém cha cái kiếp lấy chồng chung,Năm chừng mười họa hay chăng chớ,Một tháng đôi lần có cũng không,Cố đấm ăn xôi xôi lại hỏng,Cầm bằng làm mướn mướn không công,Nỗi này ví biết dường này nhỉ,Giữa dòng ngao ngán nỗi lênh đênh,Lưng khoang tình nghĩa mong đầy đặn,Nửa mạn phong ba luống bập bềnh,Chèo lái mặc ai lăm đỗ bến,Buồm lèo thây kẻ rắp xuôi ghềnh,Ấy ai thăm ván cam lòng vậy,Thiếp bén duyên chàng có thế thôi,Nòng nọc đứt đuôi từ đây nhé,Cánh phượng đường mây đã vội chi.,"Chua xót lòng xem lời để lại,","Hững hờ duyên bấy bước ra đi,","Thử vàng đá nọ treo tầng giá,","Phong gấm hoa kia nở có thì,","Đào thắm mận xanh còn thú lắm,",Sự này có thấu hỡi chăng chàng.,"Duyên thiên chưa thấy nhô đầu dọc,",Phận liễu sao mà nảy nét ngang.,"Cái tội trăm năm chàng chịu cả,",Chữ tình một khối thiếp xin mang.,"Quản chi miệng thế lời chênh lệch,",Những lời vàng đá phải lời chơi,Đường tuy nửa bước xa ngàn dặm,Duyên chửa trăm năm cũng một đời,Tần Tấn đã đành duyên gặp gỡ,Ngô Lào chi quản chuyện xa xôi,Trăng thề muôn kiếp trơ trơ đó,"Vọng vọng ngu châu nhất tự nhi,","Thủ thám giao cung giang tác lộ,","Võng thu thần thị tịch vi kỳ,","Huề la bản phụ phan thuyền vĩ,","Khấu tiệp đà sư hệ tửu chi,","Hoặc thủ chư ""ly"" kiêm thủ ""hoán"",",Là duyên là nợ phải hay chăng.,"Vịn hoa khéo kẻo lay cành gấm,",Vục nước xem mà động bóng giăng.,"Lòng nọ chớ rằng mây nhạt nhạt,",Lời kia này đã núi giăng giăng.,"Với nhau tình nghĩa sao là trọn,",Làm chi một chút tẻo tèo teo,Thuyền từ cũng muốn về Tây Trúc,Đem cái xuân tình cắm ở đâu,Rúc rích thây cha con chuột nhắt,Vo ve mặc mẹ cái ong bầu,Nào ai biết được vông hay chóc,Nọ kẻ chia ra cuống mấy đầu,Thôi thế thời thôi thôi cũng rảnh,木蕭蕭，,我夢鄉情各寂寥，,可感是春宵。,鹿呦呦，,鴈嗷嗷，,歡草相期在一朝，,不盡我心描。,江潑潑，,水活活，,我思君懷相契闊，,淚痕沾夏葛。,詩屑屑，,心切切，,濃淡寸情須兩達，,也憑君筆發。,風昂昂，,月茫茫，,風月令空客斷腸，,何處是騰王？,雲蒼蒼，,水泱泱，,雲水那堪望一場，,一場遙望觸懷忙。,日祈祈，,夜遲遲，,日夜偏懷旅思悲，,思悲應莫誤佳期。,風扉扉，,雨霏霏，,風雨頻催彩筆揮，,筆揮都是付情兒。,君有心，,我有心，,夢魂相戀柳花陰。,詩同吟，,月同斟，,一字愁分離，,何人煖半衾。,莫彈離曲怨知音，,直須棄置此瑤琴。,高山流水晚相尋，,應不恨吟歎古今。,君何期，,我何期，,施亭來得兩栖遲。,茗頻披，,筆頻揮，,一場都筆舌，,何處是情兒？,好憑心上各相知，,也應交錯此緣綈，,"芳心誓不負佳期。 Thuật ý kiêm trình hữu nhân Mai Sơn PhủHoa phiêu phiêu,","Mộc tiêu tiêu,","Ngã mộng hương tình các tịch liêu,",Khả cảm thị xuân tiêu.,"Lộc ao ao,","Nhạn ngao ngao,","Hoan thảo tương kỳ tại nhất triêu,",Bất tận ngã tâm miêu.,"Giang bát bát,","Thuỷ hoạt hoạt,","Ngã tứ quân hoài tương khế khoát,",Lệ ngân chiêm hạ cát.,"Thi tiết tiết,","Tâm thiết thiết,","Nồng đạm thốn tình tu lưỡng đạt,",Dã bằng quân bút phát.,"Phong ngang ngang,","Nguyệt mang mang,","Phong nguyệt linh không khách đoạn tràng,",Hà xứ thị Đằng Vương?,"Vân thương thương,","Thuỷ ương ương,","Vân thuỷ na kham vọng nhất trường,",Nhất trường dao vọng xúc hoài mang.,"Nhật kỳ kỳ,","Dạ trì trì,","Nhật dạ thiên hoài lữ tứ bi,",Tứ bi ưng mạc ngộ giai kỳ.,"Phong phi phi,","Vũ phi phi,","Phong vũ tần thôi thái bút huy,",Bút huy đô thị phó tình nhi.,"Quân hữu tâm,","Ngã hữu tâm,",Mộng hồn tương luyến liễu hoa âm.,"Thi đồng ngâm,",Nguyệt đồng châm.,"Nhất tự sầu phân ly,",Hà nhân noãn bán khâm.,"Mạc đàn ly khúc oán tri âm,",Trực tu khí trí thử dao cầm.,"Cao sơn lưu thuỷ vãn tương tầm,",Ưng bất hận ngâm thán cổ câm.,"Quân hà kì,","Ngã hà kì,",Lữ đình lai đắc lưỡng thê trì.,"Dánh tần phi,","Bút tần huy,","Nhất trường đô bút thiệt,",Hà xứ thị tình nhi?,"Hảo tư tâm thượng các tương tri,","Dã ưng giao thác thử duyên đề,","Phương tâm thệ bất phụ giai kỳ.

述意兼呈友人枚山甫


","Thuật ý kiêm trình hữu nhân Mai Sơn Phủ
							","Kể ý mình và trình bạn là Mai Sơn Phủ
花飄飄，","Hoa phiêu phiêu,木蕭蕭，","Mộc tiêu tiêu,我夢鄉情各寂寥，","Ngã mộng hương tình các tịch liêu,可感是春宵。",Khả cảm thị xuân tiêu. 鹿呦呦，,"Lộc ao ao,鴈嗷嗷，","Nhạn ngao ngao,歡草相期在一朝，","Hoan thảo tương kỳ tại nhất triêu,不盡我心描。",Bất tận ngã tâm miêu. 江潑潑，,"Giang bát bát,水活活，","Thuỷ hoạt hoạt,我思君懷相契闊，","Ngã tứ quân hoài tương khế khoát,淚痕沾夏葛。",Lệ ngân chiêm hạ cát. 詩屑屑，,"Thi tiết tiết,心切切，","Tâm thiết thiết,濃淡寸情須兩達，","Nồng đạm thốn tình tu lưỡng đạt,也憑君筆發。",Dã bằng quân bút phát. 風昂昂，,"Phong ngang ngang,月茫茫，","Nguyệt mang mang,風月令空客斷腸，","Phong nguyệt linh không khách đoạn tràng,何處是騰王？",Hà xứ thị Đằng Vương?雲蒼蒼，,"Vân thương thương,水泱泱，","Thuỷ ương ương,雲水那堪望一場，","Vân thuỷ na kham vọng nhất trường,一場遙望觸懷忙。",Nhất trường dao vọng xúc hoài mang. 日祈祈，,"Nhật kỳ kỳ,夜遲遲，","Dạ trì trì,日夜偏懷旅思悲，","Nhật dạ thiên hoài lữ tứ bi,思悲應莫誤佳期。",Tứ bi ưng mạc ngộ giai kỳ. 風扉扉，,"Phong phi phi,雨霏霏，","Vũ phi phi,風雨頻催彩筆揮，","Phong vũ tần thôi thái bút huy,筆揮都是付情兒。",Bút huy đô thị phó tình nhi. 君有心，,"Quân hữu tâm,我有心，","Ngã hữu tâm,夢魂相戀柳花陰。",Mộng hồn tương luyến liễu hoa âm.詩同吟，,"Thi đồng ngâm,月同斟，",Nguyệt đồng châm.一字愁分離，,"Nhất tự sầu phân ly,何人煖半衾。",Hà nhân noãn bán khâm.莫彈離曲怨知音，,"Mạc đàn ly khúc oán tri âm,直須棄置此瑤琴。",Trực tu khí trí thử dao cầm.高山流水晚相尋，,"Cao sơn lưu thuỷ vãn tương tầm,應不恨吟歎古今。",Ưng bất hận ngâm thán cổ câm. 君何期，,"Quân hà kì,我何期，","Ngã hà kì,施亭來得兩栖遲。",Lữ đình lai đắc lưỡng thê trì.茗頻披，,"Dánh tần phi,筆頻揮，","Bút tần huy,一場都筆舌，","Nhất trường đô bút thiệt,何處是情兒？",Hà xứ thị tình nhi?好憑心上各相知，,"Hảo tư tâm thượng các tương tri,也應交錯此緣綈，","Dã ưng giao thác thử duyên đề,芳心誓不負佳期。",長途著腳乍關懷。,庭前象馬銀雙鎖，,宮裡衣冠玉一堆。,草木暗隨冬雪老，,江山還為昔人哀。,皇天有意開新運，,"風捲紅塵拂劫灰。 Quá Khinh Dao từ hoài cổSơn hải tang bồng cổ dĩ lai,",Trường đồ trước cước sạ quan hoài.,"Đình tiền tượng mã ngân song toả,",Cung lý y quan ngọc nhất đôi.,"Thảo mộc ám tuỳ đông tuyết lão,",Giang sơn hoàn vị tích nhân ai.,"Hoàng thiên hữu ý khai tân vận,","Phong quyển hồng trần phất kiếp hôi.

過京瑤祠懷古


","Quá Khinh Dao từ hoài cổ
							","Qua đền Khinh Dao nhớ chuyện xưa
山海桑蓬古已來，","Sơn hải tang bồng cổ dĩ lai,長途著腳乍關懷。",Trường đồ trước cước sạ quan hoài.庭前象馬銀雙鎖，,"Đình tiền tượng mã ngân song toả,宮裡衣冠玉一堆。",Cung lý y quan ngọc nhất đôi.草木暗隨冬雪老，,"Thảo mộc ám tuỳ đông tuyết lão,江山還為昔人哀。",Giang sơn hoàn vị tích nhân ai.皇天有意開新運，,"Hoàng thiên hữu ý khai tân vận,風捲紅塵拂劫灰。",Này của Xuân Hương mới quệt rồi,Có phải duyên nhau thì thắm lại,Xin đừng lo lắng hết xuân xanh.,"Tấc gang tay hoạ thơ không dứt,",Gần gụi cung dương lá vẫn lành.,"Tên sẵn bút đề dường chĩnh chện,",Trống mang dùi cắp đã phanh phanh.,"Tuy không thả lá trôi dòng ngự,",Ông Chồng đã vậy lại Bà Chồng.,"Tầng trên tuyết điểm phơ đầu bạc,",Thớt dưới sương pha đượm má hồng.,"Gan nghĩa dãi ra cùng chị Nguyệt,",Khối tình cọ mãi với non sông.,"Đá kia còn biết xuân già giặn,",Thương vì một nỗi hãy còn không.,"Thương con cuốc rũ kêu mùa Hạ,",Thương cái bèo non giạt bể Ðông.,"Thương cha mẹ nhện vương tơ lưới,",Thương vợ chồng Ngâu cách mặt sông.,"Ấy thương quân tử thương là thế,",Vó ký dùng dằng bước chẳng đi,Lưu giản đôi câu sa giọt ngọc,Tương tư nửa gánh nặng vai chì,Cầm thông sầu gảy năm cung biệt,Rượu cúc say nghiêng một chén ly,Tưởng nước non này trăng gió ấy
